acquisition_mode,expected_format,file_label,licence_gate,notes,parse_command,raw_handling,snapshot_command,source_file_id,source_id,source_url,source_version_id,step_id,suggested_local_path
manual_download,TXT,MBS 20260701 item map TXT,public_reuse_review,Manual download into data/raw_live/au_mbs; do not commit raw file until reuse terms are reviewed. Keep the raw file outside git; commit only derived rows and snapshots.,# Parse after both MBS TXT files are present: reimbursement-atlas parse-mbs-txt-pair data/raw_live/au_mbs/20260701_MBSONLINE_IMAP.TXT data/raw_live/au_mbs/20260701_MBSONLINE_DESC.TXT --output-dir data/derived/reviewed_sources/au_mbs_20260701_txt_pair,local_raw_only,reimbursement-atlas snapshot-local-file --source-version-id au_mbs_20260701_txt_pair --content-type text/plain data/raw_live/au_mbs/20260701_MBSONLINE_IMAP.TXT,au_mbs_20260701_imap_txt,au_mbs,https://www.mbsonline.gov.au/internet/mbsonline/publishing.nsf/650f3eec0dfb990fca25692100069854/1bc94358d4f276d3ca257ccf0000aa73/%24FILE/20260701_MBSONLINE_IMAP.TXT,au_mbs_20260701_txt_pair,step_001,data/raw_live/au_mbs/20260701_MBSONLINE_IMAP.TXT
manual_download,TXT,MBS 20260701 item descriptors TXT,public_reuse_review,Join with item-map by MBS item code to produce derived schedule rows. Keep the raw file outside git; commit only derived rows and snapshots.,# Parse after both MBS TXT files are present: reimbursement-atlas parse-mbs-txt-pair data/raw_live/au_mbs/20260701_MBSONLINE_IMAP.TXT data/raw_live/au_mbs/20260701_MBSONLINE_DESC.TXT --output-dir data/derived/reviewed_sources/au_mbs_20260701_txt_pair,local_raw_only,reimbursement-atlas snapshot-local-file --source-version-id au_mbs_20260701_txt_pair --content-type text/plain data/raw_live/au_mbs/20260701_MBSONLINE_DESC.TXT,au_mbs_20260701_desc_txt,au_mbs,https://www.mbsonline.gov.au/internet/mbsonline/publishing.nsf/650f3eec0dfb990fca25692100069854/1bc94358d4f276d3ca257ccf0000aa73/%24FILE/20260701_MBSONLINE_DESC.TXT,au_mbs_20260701_txt_pair,step_002,data/raw_live/au_mbs/20260701_MBSONLINE_DESC.TXT
landing_page_review,HTML metadata,CMS 26CLABQ3 file page,metadata_only,Metadata-only row is safe for source tracking; raw zip is separate and AMA-gated. This acquisition-pack row is metadata-only until a human accepts any gate.,# No parser runs for metadata-only landing/API records.,metadata_only,# Metadata-only record; review the landing page or endpoint before downloading.,us_cms_clfs_26clabq3_page,us_cms_clfs,https://www.cms.gov/medicare/payment/fee-schedules/clinical-laboratory-fee-schedule-clfs/files/26clabq3,us_cms_clfs_26clabq3_ama_zip,step_003,data/raw_live/us_cms_clfs/26CLABQ3 landing page
licence_clickthrough_manual,ZIP containing CLFS file,CMS 26CLABQ3 AMA-gated ZIP,restricted_or_licence_review,The repo must not automate licence acceptance or redistribute CPT descriptors. This acquisition-pack row is metadata-only until a human accepts any gate.,# No parser runs for metadata-only landing/API records.,metadata_only,# Metadata-only record; review the landing page or endpoint before downloading.,us_cms_clfs_26clabq3_ama_zip,us_cms_clfs,https://www.cms.gov/license/ama?file=/files/zip/26clabq3.zip,us_cms_clfs_26clabq3_ama_zip,step_004,data/raw_live/us_cms_clfs/26clabq3.zip
api_rate_limited,JSON or CSV,PBS API v3 documentation and CSV distribution,public_reuse_review,Published price fields are not confidential net government prices. This acquisition-pack row is metadata-only until a human accepts any gate.,# No parser runs for metadata-only landing/API records.,metadata_only,# Metadata-only record; review the landing page or endpoint before downloading.,au_pbs_api_v3_documentation,au_pbs,https://data.pbs.gov.au/document/91327.html,au_pbs_api_v3_current_month,step_005,data/raw_live/au_pbs/PBS API/CSV endpoints
manual_extract,ZIP/XLSX/CSV manual extract,CMS ASP July 2026 payment-limit files page,public_reuse_review,"Treat as payment-limit evidence only, not coverage evidence. This acquisition-pack row is metadata-only until a human accepts any gate.",# No parser runs for metadata-only landing/API records.,metadata_only,# Metadata-only record; review the landing page or endpoint before downloading.,us_cms_asp_july_2026_payment_limit_page,us_cms_asp,https://www.cms.gov/medicare/payment/part-b-drugs/asp-pricing-files,us_cms_asp_july_2026_payment_limit,step_006,data/raw_live/us_cms_asp/July 2026 ASP payment-limit files
manual_extract,ZIP/XLSX manual extract,CMS PFS RVU26C relative value files page,restricted_or_licence_review,Payment calculations require conversion factor and locality adjustments beyond RVUs. This acquisition-pack row is metadata-only until a human accepts any gate.,# No parser runs for metadata-only landing/API records.,metadata_only,# Metadata-only record; review the landing page or endpoint before downloading.,us_cms_pfs_rvu26c_page,us_cms_pfs,https://www.cms.gov/medicare/payment/fee-schedules/physician/pfs-relative-value-files,us_cms_pfs_rvu26c,step_007,data/raw_live/us_cms_pfs/RVU26C relative value files
