deliverables,depends_on,github_project_status,goal,id,notes,phase,priority,title,workstream
"[""Mojo kernel smoke tests"", ""Python 3.14 CI matrix"", ""runtime target table"", ""fallback policy for current sandbox""]",[],ready_for_issue_sync,Make Mojo the explicit performance-kernel layer while targeting Python 3.14 for orchestration and packaging once CI can install it.,track_runtime_mojo_python314,"Stable orchestration remains typed Python, but performance-critical tokenisation, fuzzy matching and vector prefilters are tracked as Mojo kernels.",hardening,must,Mojo-first runtime and Python 3.14 compatibility,runtime
"[""source downloader"", ""download attempt log"", ""MBS pair bundle"", ""CMS CLFS safe parser"", ""PBS API extract""]","[""track_runtime_mojo_python314""]",ready_for_issue_sync,"Download or API-fetch public sources using curl/wget/API clients, snapshot them locally, and publish derived-only validated records.",track_live_source_ingestion,Raw source files remain ignored and local-only unless licence review explicitly permits redistribution.,implementation,must,Evidence-grade live source ingestion,data
"[""OSF component plan"", ""protocol templates"", ""research question reports"", ""preprint checklist""]",[],ready_for_issue_sync,"Treat each policy question as a protocolled research output with OSF components, reports, appendices and preprint pathways.",track_research_protocols_osf,OSF is the protocol/report archive; GitHub is the implementation repo; Hugging Face is the derived data/dashboard distribution path.,design,must,OSF research protocol and report workflow,research
"[""dataset card"", ""Space README"", ""conditional publish workflow"", ""static dashboard bundle""]","[""track_live_source_ingestion""]",ready_for_issue_sync,Package licence-safe derived data for Hugging Face Datasets and deploy the static dashboard to Hugging Face Spaces.,track_publication_hf_spaces,"Publication is blocked until licence gates, source redaction and release readiness pass.",implementation,must,Hugging Face dataset and Spaces publication,publication
"[""datapackage.json"", ""ro-crate-metadata.json"", ""DCAT JSON-LD"", ""Zenodo metadata""]","[""track_publication_hf_spaces""]",ready_for_issue_sync,"Emit Frictionless Data Package, RO-Crate, DCAT and citation metadata for release candidates.",track_data_packaging_standards,"These outputs support reproducibility, discovery and archival release.",implementation,should,Research-data packaging standards,publication
"[""review UI tables"", ""gold-standard fixtures"", ""negative controls"", ""mapping confidence calibration""]","[""track_live_source_ingestion""]",ready_for_issue_sync,"Move from deterministic candidate crosswalks to adjudicated mapping evidence with gold standards, negative controls and reviewer state.",track_mapping_workbench,No high-impact policy output should rely on unreviewed automatic crosswalks.,implementation,must,Human-in-the-loop mapping workbench,mappings
"[""SHA-pinned actions"", ""blocking workflow security"", ""pip-audit network CI"", ""branch protection as code""]",[],ready_for_issue_sync,"Make release gates enforceable through GitHub Actions, action SHA pinning, SBOMs, attestations, Scorecard, CodeQL, dependency review and zizmór.",track_ci_cd_supply_chain,"Current sandbox cannot resolve all network gates, so the repo records blocked states explicitly.",hardening,must,CI/CD and supply-chain hardening,automation
"[""protocolled analyses"", ""reproducible notebooks/scripts"", ""policy briefs"", ""dashboard views""]","[""track_live_source_ingestion"", ""track_mapping_workbench"", ""track_research_protocols_osf""]",ready_for_issue_sync,"Produce publishable demonstrations for genomics/pathology, cognitive-procedural relativities, medicine price opacity and coverage discretion.",track_policy_demonstrators,Demonstrators should prioritise policy architecture and uncertainty over simplistic price league tables.,analysis,must,First policy demonstrators,analytics
