command,evidence_path,id,recommended_action,required_environment,status,task_group,title,unblock_condition
PYTHONPATH=src reimbursement-atlas source-download-plan --method curl && bash data/derived/source_downloads/download_commands.sh,data/derived/source_downloads/download_attempts.jsonl,final_source_downloads,"Run first, then rerun source-validation and source-contracts.",Network-enabled local machine or GitHub runner with outbound HTTPS.,complete,source_ingestion,Run hardened curl/wget source download plan,MBS/PBS/CMS source hosts resolve and downloads complete into ignored data/raw_live storage.
PYTHONPATH=src reimbursement-atlas reviewed-mbs-txt-pair-bundle data/raw_live/au_mbs/20260701_MBSONLINE_IMAP.TXT data/raw_live/au_mbs/20260701_MBSONLINE_DESC.TXT,data/derived/reviewed_source_bundles/,final_mbs_pair_bundle,Commit only derived rows and redacted provenance after licence review.,Local checkout with downloaded MBS item-map and descriptor TXT files.,ready_local,source_ingestion,Create reviewed derived-only MBS TXT pair bundle,Both July 2026 MBS TXT files exist in ignored local raw storage.
PYTHONPATH=src reimbursement-atlas source-files,docs/LIVE_SOURCE_VALIDATION_PLAYBOOK.md,final_cms_clfs_licence_review,Avoid CPT descriptor redistribution; publish payment/metadata only when permitted.,Human review of AMA/CPT licence implications before parsing or publishing fields.,blocked_review,source_ingestion,Review CMS CLFS AMA-gated file and derived-field policy,Reviewer approves the set of derived CLFS fields that can be stored and published.
uv run --all-extras pip-audit --strict,data/derived/external_quality_gates.json,final_pip_audit_strict,Make this a required release gate in CI before public release.,Network-enabled Python environment with access to PyPI advisory APIs.,complete,security,Run pip-audit strict in a network-enabled environment,PyPI advisory lookup completes with no unresolved vulnerabilities.
PYTHONPATH=src python scripts/resolve_action_pins.py,data/derived/repo_automation/action_pin_resolution.jsonl,final_action_sha_pinning,Keep all third-party Actions SHA-pinned and zizmor medium findings blocking.,Network-enabled environment with GitHub API access.,complete,automation,Resolve GitHub Action tags to immutable SHAs,All action references are resolved and workflows use immutable SHAs where practical.
gh workflow run huggingface.yml,.github/workflows/huggingface.yml,final_hf_dataset_space,Run as a dry release first; inspect dataset card and Space build logs.,"GitHub Actions with HF_TOKEN, HF_DATASET_REPO and HF_SPACE_REPO secrets.",blocked_secret,publication,Publish gated Hugging Face dataset and Space dry run,Secrets are configured and publication manifest has no raw-source warnings.
gh workflow run osf.yml,data/derived/osf/osf_publication_manifest.json,final_osf_protocol_pack,"Treat OSF upload as preregistration candidate, not final publication, until approved.",OSF personal access token and approved protocol text.,blocked_secret,research,Create OSF protocol/report components and upload preregistration pack,Protocols are human-reviewed and OSF credentials are configured.
pixi run mapping-calibration,data/derived/vertical_slice/mapping_calibration_gate.json,final_mapping_calibration_review,Do not use the current calibration precision/specificity as evidence-grade performance; resolve the two triggered negative controls first.,Human domain review of the synthetic mapping calibration cases.,blocked_review,mappings,Adjudicate mapping gold standards and negative controls,Reviewer confirms the positive/negative control outcomes and approves the mapping threshold for the intended research question.
PYTHONPATH=src reimbursement-atlas release-readiness && PYTHONPATH=src reimbursement-atlas data-quality,data/derived/release_readiness/summary.json,final_release_candidate,"Only then cut a signed, attested public release and archive to Zenodo/OSF.",Network-enabled runner after source/security/publication gates complete.,blocked_review,release,Generate final release-readiness report and public archive,"Required software blockers are zero and repository_release_ready is true. Research, evidence and policy-claim readiness remain separate fail-closed gates."
